<?xml version="1.0" encoding="ISO-8859-1"?>

<shiporder orderid="889923"
		   xmlns:xsi="http://www.w3.org/2001/XMLSchema-instance"
		   xsi:noNamespaceSchemaLocation="order.xsd">
  <orderperson>John Smith</orderperson>
  <start>2011-02-14</start>
  <shipto>
    <name>Sherlock Holmes</name>
    <address>221b, Baker Str</address>
    <city>London NW1 6XE</city>
    <country>UK</country>
  </shipto>
  <item>
    <title>Smoking pipe</title>
    <note>Special Edition</note>
    <quantity>1</quantity>
    <price>10.90</price>
  </item>
  <item>
    <title>Violin</title>
    <quantity>1</quantity>
    <price>99.99</price>
  </item>
</shiporder>